rebal_date,eval_year,eval_month,eval_period,n_countries,bm_return,top1_return,top1_country,top1_prob,bot1_return,bot1_country,bot1_prob,top3_return,top3_countries,bot3_return,bot3_countries,top5_return,top5_countries,bot5_return,bot5_countries,top8_return,top8_countries,bot8_return,bot8_countries,top10_return,top10_countries,bot10_return,bot10_countries
2022-12-30,2023,1,2023-01,23,3.151578522474712,4.355195440243409,Hungary,0.9998694466396694,2.451892412452028,India,0.00040716199009100686,4.480321494785937,"Hungary, Mexico, Brazil",2.26632615133379,"Georgia, Uruguay, India",4.9623316175985845,"Hungary, Mexico, Brazil, Romania, Serbia",1.9797454975446627,"Poland, Paraguay, Georgia, Uruguay, India",4.561142607839774,"Hungary, Mexico, Brazil, Romania, Serbia, Colombia, Chile, Panama",1.832937346836394,"Turkey, Oman, China, Poland, Paraguay, Georgia, Uruguay, India",4.3541928140334045,"Hungary, Mexico, Brazil, Romania, Serbia, Colombia, Chile, Panama, Peru, Malaysia",1.8242460192354115,"Kazakhstan, Azerbaijan, Turkey, Oman, China, Poland, Paraguay, Georgia, Uruguay, India"
2023-01-31,2023,2,2023-02,23,-2.9153591425521905,-5.4545652288237605,Colombia,0.9940281415833278,-3.683449447130571,Uruguay,0.0013080837562300701,-3.6075841042878865,"Colombia, Brazil, SouthAfrica",-3.6543555870479785,"Paraguay, Serbia, Uruguay",-3.764386466691916,"Colombia, Brazil, SouthAfrica, Philippines, Chile",-3.6895220153044184,"Mexico, Romania, Paraguay, Serbia, Uruguay",-3.3340189704161274,"Colombia, Brazil, SouthAfrica, Philippines, Chile, Panama, Oman, Indonesia",-3.4897528545306327,"Hungary, India, Malaysia, Mexico, Romania, Paraguay, Serbia, Uruguay",-2.977492192925819,"Colombia, Brazil, SouthAfrica, Philippines, Chile, Panama, Oman, Indonesia, China, Poland",-2.897625946252662,"Azerbaijan, Georgia, Hungary, India, Malaysia, Mexico, Romania, Paraguay, Serbia, Uruguay"
2023-02-28,2023,3,2023-03,23,3.1243771861960936,3.3261014677884004,Mexico,0.9922950283822973,0.9381713127315727,Azerbaijan,0.025396425095507966,3.75055388200524,"Mexico, Brazil, Paraguay",2.266344174274796,"China, India, Azerbaijan",3.8538622022886626,"Mexico, Brazil, Paraguay, Chile, Peru",1.5303994260457987,"Georgia, Serbia, China, India, Azerbaijan",3.2528481153070667,"Mexico, Brazil, Paraguay, Chile, Peru, Philippines, SouthAfrica, Oman",2.025848054925561,"Romania, Poland, Turkey, Georgia, Serbia, China, India, Azerbaijan",3.4438688130118793,"Mexico, Brazil, Paraguay, Chile, Peru, Philippines, SouthAfrica, Oman, Hungary, Colombia",2.2156481314896936,"Panama, Uruguay, Romania, Poland, Turkey, Georgia, Serbia, China, India, Azerbaijan"
2023-03-31,2023,4,2023-04,23,-0.029103758643332863,-3.8885066288752546,Colombia,0.9629037263337926,-1.1884332483696025,Mexico,0.00564610074480456,-0.8725116312060818,"Colombia, Georgia, Paraguay",-0.8586284436829184,"Malaysia, India, Mexico",-0.4769575359601719,"Colombia, Georgia, Paraguay, SouthAfrica, Philippines",-0.406809322792574,"Uruguay, China, Malaysia, India, Mexico",0.1808917433560847,"Colombia, Georgia, Paraguay, SouthAfrica, Philippines, Oman, Serbia, Indonesia",-0.15576394633628754,"Poland, Panama, Brazil, Uruguay, China, Malaysia, India, Mexico",0.29769388793067453,"Colombia, Georgia, Paraguay, SouthAfrica, Philippines, Oman, Serbia, Indonesia, Azerbaijan, Peru",0.005289552053708846,"Turkey, Kazakhstan, Poland, Panama, Brazil, Uruguay, China, Malaysia, India, Mexico"
2023-04-28,2023,5,2023-05,23,-0.7349314496234814,-0.6639969502395648,Mexico,0.9919726763069783,0.85027602148946,India,0.04280778761194039,-1.0244382712668327,"Mexico, Paraguay, Georgia",-1.2030519552904426,"Serbia, Uruguay, India",-0.36749739521548586,"Mexico, Paraguay, Georgia, Colombia, Brazil",-1.041290800709913,"Peru, Poland, Serbia, Uruguay, India",-0.620629322083896,"Mexico, Paraguay, Georgia, Colombia, Brazil, Hungary, Oman, Philippines",-0.777608228276816,"Kazakhstan, Azerbaijan, Chile, Peru, Poland, Serbia, Uruguay, India",-0.8273210553767008,"Mexico, Paraguay, Georgia, Colombia, Brazil, Hungary, Oman, Philippines, SouthAfrica, China",-0.9250446637024801,"Romania, Turkey, Kazakhstan, Azerbaijan, Chile, Peru, Poland, Serbia, Uruguay, India"
2023-05-31,2023,6,2023-06,23,1.1340524180052716,1.481849023561388,Hungary,0.9986011048633313,-0.694481538767644,India,0.018974262280480988,2.084100642735942,"Hungary, SouthAfrica, Brazil",-0.23272671601948605,"China, Uruguay, India",1.9976567349728256,"Hungary, SouthAfrica, Brazil, Paraguay, Mexico",-0.1655703210184689,"Azerbaijan, Poland, China, Uruguay, India",2.177891073139077,"Hungary, SouthAfrica, Brazil, Paraguay, Mexico, Peru, Colombia, Turkey",0.12638241220527952,"Kazakhstan, Malaysia, Romania, Azerbaijan, Poland, China, Uruguay, India",1.9842330291847279,"Hungary, SouthAfrica, Brazil, Paraguay, Mexico, Peru, Colombia, Turkey, Georgia, Serbia",0.26989572551019525,"Panama, Indonesia, Kazakhstan, Malaysia, Romania, Azerbaijan, Poland, China, Uruguay, India"
2023-06-30,2023,7,2023-07,23,0.6832331886456159,0.7722376759020655,Hungary,0.994221402708979,-0.10876223031123233,India,0.0069929629351804775,0.6500083949746216,"Hungary, Paraguay, Georgia",0.6111632130920067,"Azerbaijan, Serbia, India",0.4597461520997226,"Hungary, Paraguay, Georgia, Oman, Peru",0.39239120317081877,"Romania, Malaysia, Azerbaijan, Serbia, India",0.6098934973241432,"Hungary, Paraguay, Georgia, Oman, Peru, Colombia, Chile, China",0.2518982560724775,"Indonesia, Poland, Uruguay, Romania, Malaysia, Azerbaijan, Serbia, India",0.49817165715318135,"Hungary, Paraguay, Georgia, Oman, Peru, Colombia, Chile, China, Philippines, Mexico",0.6571034745529204,"Turkey, Kazakhstan, Indonesia, Poland, Uruguay, Romania, Malaysia, Azerbaijan, Serbia, India"
2023-07-31,2023,8,2023-08,23,-1.0123825118244867,-0.9850257381065375,Hungary,0.9997017606418201,-0.34806977405640316,India,0.010822572822021932,-1.3294592988540372,"Hungary, Peru, Chile",-0.8972210657191781,"Serbia, Paraguay, India",-1.3463408894115414,"Hungary, Peru, Chile, Brazil, SouthAfrica",-0.7929591806470482,"Mexico, Azerbaijan, Serbia, Paraguay, India",-1.3530388458460552,"Hungary, Peru, Chile, Brazil, SouthAfrica, Colombia, Philippines, Malaysia",-0.8870487216057349,"Uruguay, Romania, Oman, Mexico, Azerbaijan, Serbia, Paraguay, India",-1.0674884762615033,"Hungary, Peru, Chile, Brazil, SouthAfrica, Colombia, Philippines, Malaysia, China, Georgia",-0.9197051500849895,"Indonesia, Kazakhstan, Uruguay, Romania, Oman, Mexico, Azerbaijan, Serbia, Paraguay, India"
2023-08-31,2023,9,2023-09,23,-3.587563895972529,-4.2361520287634065,Hungary,0.9901757429841055,-1.5673476264435604,India,0.005375958729575227,-4.686591117412031,"Hungary, Chile, Colombia",-2.5271764936371324,"Oman, Paraguay, India",-4.275767503463048,"Hungary, Chile, Colombia, Philippines, SouthAfrica",-2.762120088213984,"Azerbaijan, Romania, Oman, Paraguay, India",-3.8813734064067447,"Hungary, Chile, Colombia, Philippines, SouthAfrica, Georgia, Malaysia, Panama",-2.7345665691968533,"Turkey, China, Peru, Azerbaijan, Romania, Oman, Paraguay, India",-4.020050373691967,"Hungary, Chile, Colombia, Philippines, SouthAfrica, Georgia, Malaysia, Panama, Mexico, Indonesia",-2.9893549638756722,"Poland, Serbia, Turkey, China, Peru, Azerbaijan, Romania, Oman, Paraguay, India"
2023-09-29,2023,10,2023-10,23,-0.39674937464451143,0.522597996421803,Hungary,0.9998924439526505,0.3941396501043304,China,0.0009499773590112705,-0.20957789269265095,"Hungary, Chile, SouthAfrica",0.37099944323160106,"Brazil, Poland, China",-0.6875205304055321,"Hungary, Chile, SouthAfrica, Peru, Philippines",0.6133260362745974,"India, Turkey, Brazil, Poland, China",-0.08681105229886021,"Hungary, Chile, SouthAfrica, Peru, Philippines, Serbia, Colombia, Malaysia",0.18461333199170094,"Azerbaijan, Mexico, Oman, India, Turkey, Brazil, Poland, China",-0.6128124684655567,"Hungary, Chile, SouthAfrica, Peru, Philippines, Serbia, Colombia, Malaysia, Panama, Indonesia",0.027976683161716753,"Kazakhstan, Georgia, Azerbaijan, Mexico, Oman, India, Turkey, Brazil, Poland, China"
2023-10-31,2023,11,2023-11,23,5.176854034751115,7.190846487997571,Chile,0.9918558915477277,3.2826939030429436,India,0.006720466006168755,6.934303685329901,"Chile, Colombia, Hungary",2.781031383639602,"Turkey, Serbia, India",6.7332429092134705,"Chile, Colombia, Hungary, Philippines, Uruguay",3.315604877975514,"Brazil, Oman, Turkey, Serbia, India",6.0303133383175584,"Chile, Colombia, Hungary, Philippines, Uruguay, SouthAfrica, Paraguay, Georgia",3.872497983588788,"Romania, Malaysia, Azerbaijan, Brazil, Oman, Turkey, Serbia, India",5.88001559238226,"Chile, Colombia, Hungary, Philippines, Uruguay, SouthAfrica, Paraguay, Georgia, Peru, Panama",3.825838514116815,"Poland, China, Romania, Malaysia, Azerbaijan, Brazil, Oman, Turkey, Serbia, India"
2023-11-30,2023,12,2023-12,23,3.412867060300527,4.465901562460162,Paraguay,0.9975263114268699,2.335055844340128,India,0.0077036645512657,4.432082155246108,"Paraguay, Georgia, Colombia",2.434532538891254,"Brazil, Peru, India",4.233897181023675,"Paraguay, Georgia, Colombia, Hungary, Chile",1.9595569841456986,"Serbia, Azerbaijan, Brazil, Peru, India",4.2690295403230305,"Paraguay, Georgia, Colombia, Hungary, Chile, SouthAfrica, Philippines, Romania",2.2365084674089957,"China, Oman, Malaysia, Serbia, Azerbaijan, Brazil, Peru, India",4.12771470234671,"Paraguay, Georgia, Colombia, Hungary, Chile, SouthAfrica, Philippines, Romania, Panama, Indonesia",2.491855970913548,"Mexico, Turkey, China, Oman, Malaysia, Serbia, Azerbaijan, Brazil, Peru, India"
2023-12-29,2024,1,2024-01,23,-0.30864616912532367,2.1237867158243384,Romania,0.9998597257953625,0.012094317590305437,Uruguay,5.4560993936531474e-05,1.1668025759457763,"Romania, Mexico, India",-0.555155516624776,"Turkey, Hungary, Uruguay",0.8445924888941114,"Romania, Mexico, India, Serbia, China",-0.535461161911932,"Panama, Paraguay, Turkey, Hungary, Uruguay",0.6242760801284206,"Romania, Mexico, India, Serbia, China, Georgia, Poland, Brazil",-0.6159102995496726,"Oman, SouthAfrica, Malaysia, Panama, Paraguay, Turkey, Hungary, Uruguay",0.5128946857878358,"Romania, Mexico, India, Serbia, China, Georgia, Poland, Brazil, Azerbaijan, Chile",-0.8311470466269177,"Indonesia, Colombia, Oman, SouthAfrica, Malaysia, Panama, Paraguay, Turkey, Hungary, Uruguay"
2024-01-31,2024,2,2024-02,23,-0.8129878145026261,-0.5800888273944538,India,0.9973464928903069,-1.4510064438325698,Uruguay,0.0021019027909817693,-0.29797648008276223,"India, Oman, Serbia",-1.6444387168364862,"Romania, Malaysia, Uruguay",-0.06848526724698711,"India, Oman, Serbia, Turkey, China",-1.488359586117498,"Paraguay, Peru, Romania, Malaysia, Uruguay",-0.2329731571929769,"India, Oman, Serbia, Turkey, China, Azerbaijan, Brazil, Indonesia",-1.4036754328505472,"Chile, Mexico, Panama, Paraguay, Peru, Romania, Malaysia, Uruguay",-0.23447118974731285,"India, Oman, Serbia, Turkey, China, Azerbaijan, Brazil, Indonesia, Kazakhstan, Colombia",-1.354213017477254,"Philippines, SouthAfrica, Chile, Mexico, Panama, Paraguay, Peru, Romania, Malaysia, Uruguay"
2024-02-29,2024,3,2024-03,23,0.5408837613620039,0.0679304438682582,SouthAfrica,0.9629400975417741,-0.566378842605253,Malaysia,0.00837229425904609,0.40508546943216484,"SouthAfrica, Serbia, Oman",0.6570261649282835,"Turkey, Paraguay, Malaysia",0.3120114708077848,"SouthAfrica, Serbia, Oman, Georgia, Brazil",0.6882438288899896,"Romania, Uruguay, Turkey, Paraguay, Malaysia",0.2519698415447427,"SouthAfrica, Serbia, Oman, Georgia, Brazil, Poland, Colombia, India",0.4348412653301756,"Peru, China, Chile, Romania, Uruguay, Turkey, Paraguay, Malaysia",0.33010190018530783,"SouthAfrica, Serbia, Oman, Georgia, Brazil, Poland, Colombia, India, Indonesia, Philippines",0.5781346271035803,"Panama, Hungary, Peru, China, Chile, Romania, Uruguay, Turkey, Paraguay, Malaysia"
2024-03-28,2024,4,2024-04,23,-1.8717256752161102,-1.5203281186183637,Oman,0.9390308906936599,-2.8510152885185103,Paraguay,0.0020606798043730037,-0.7600939552896868,"Oman, SouthAfrica, Serbia",-2.2786268212207674,"Panama, Malaysia, Paraguay",-0.9350228063149313,"Oman, SouthAfrica, Serbia, Turkey, Hungary",-2.3690689177938506,"Romania, Mexico, Panama, Malaysia, Paraguay",-0.981801832846857,"Oman, SouthAfrica, Serbia, Turkey, Hungary, Brazil, Azerbaijan, China",-2.4686258327850084,"Peru, Colombia, Chile, Romania, Mexico, Panama, Malaysia, Paraguay",-1.2790093584136564,"Oman, SouthAfrica, Serbia, Turkey, Hungary, Brazil, Azerbaijan, China, Poland, Philippines",-2.2817764283772424,"Uruguay, India, Peru, Colombia, Chile, Romania, Mexico, Panama, Malaysia, Paraguay"
2024-04-30,2024,5,2024-05,23,2.3189729907434495,2.8338645722776112,Malaysia,0.9980788983343315,-0.9724257894073607,Georgia,0.02097029230790222,2.632544472989943,"Malaysia, SouthAfrica, Hungary",0.7552976770041705,"China, Turkey, Georgia",2.0654961458532117,"Malaysia, SouthAfrica, Hungary, Serbia, Uruguay",1.5069380684143077,"Chile, India, China, Turkey, Georgia",2.16641246523209,"Malaysia, SouthAfrica, Hungary, Serbia, Uruguay, Romania, Colombia, Oman",2.005145655793582,"Paraguay, Panama, Brazil, Chile, India, China, Turkey, Georgia",2.217311207528978,"Malaysia, SouthAfrica, Hungary, Serbia, Uruguay, Romania, Colombia, Oman, Indonesia, Poland",1.9624156052974726,"Mexico, Azerbaijan, Paraguay, Panama, Brazil, Chile, India, China, Turkey, Georgia"
2024-05-31,2024,6,2024-06,23,-0.192987358679921,0.457085148157077,Oman,0.9978002174857319,-0.12739240188078815,India,0.005380825176162965,-0.12096673187182623,"Oman, Serbia, Malaysia",-0.3044196492130354,"Paraguay, Turkey, India",-0.19691845024850885,"Oman, Serbia, Malaysia, Uruguay, Georgia",-0.34726713300665013,"Chile, Panama, Paraguay, Turkey, India",-0.16178725738088123,"Oman, Serbia, Malaysia, Uruguay, Georgia, Romania, China, Poland",-0.30022098962035615,"Indonesia, Philippines, Brazil, Chile, Panama, Paraguay, Turkey, India",-0.00044434910839608044,"Oman, Serbia, Malaysia, Uruguay, Georgia, Romania, China, Poland, SouthAfrica, Peru",-0.28341617180494216,"Colombia, Azerbaijan, Indonesia, Philippines, Brazil, Chile, Panama, Paraguay, Turkey, India"
2024-06-28,2024,7,2024-07,23,2.981457150399353,2.016929570694259,Oman,0.9861150362445097,4.023247928886664,Paraguay,0.009601062392681001,1.91590779660602,"Oman, Mexico, Serbia",3.0629393445521664,"Turkey, Romania, Paraguay",2.0564505435673963,"Oman, Mexico, Serbia, Hungary, Azerbaijan",3.155638686288018,"SouthAfrica, Peru, Turkey, Romania, Paraguay",2.4876902562422556,"Oman, Mexico, Serbia, Hungary, Azerbaijan, Poland, Indonesia, Uruguay",3.1516157810366288,"China, Chile, Malaysia, SouthAfrica, Peru, Turkey, Romania, Paraguay",2.365420817854016,"Oman, Mexico, Serbia, Hungary, Azerbaijan, Poland, Indonesia, Uruguay, Kazakhstan, India",3.3079417439709973,"Panama, Colombia, China, Chile, Malaysia, SouthAfrica, Peru, Turkey, Romania, Paraguay"
2024-07-31,2024,8,2024-08,23,1.931671606273116,1.7257584683462168,Azerbaijan,0.9315079817705956,2.343368606651919,Paraguay,0.00021195626054251786,1.2854307699285528,"Azerbaijan, Serbia, Oman",1.8988427137717867,"Uruguay, Romania, Paraguay",1.6243345312887,"Azerbaijan, Serbia, Oman, Poland, Hungary",2.1043907158611797,"SouthAfrica, Panama, Uruguay, Romania, Paraguay",1.801962844488242,"Azerbaijan, Serbia, Oman, Poland, Hungary, Brazil, Indonesia, Colombia",1.9608304237650587,"Peru, Malaysia, China, SouthAfrica, Panama, Uruguay, Romania, Paraguay",1.8558633559211082,"Azerbaijan, Serbia, Oman, Poland, Hungary, Brazil, Indonesia, Colombia, Chile, Kazakhstan",1.8354847079304482,"India, Mexico, Peru, Malaysia, China, SouthAfrica, Panama, Uruguay, Romania, Paraguay"
2024-08-30,2024,9,2024-09,23,1.8887126729418136,1.26639680119911,Uruguay,0.994203276970553,2.3934816491861133,Paraguay,0.0004996308318449181,1.2413920329409727,"Uruguay, India, Georgia",2.555133421855982,"SouthAfrica, Turkey, Paraguay",0.9877402418089742,"Uruguay, India, Georgia, Serbia, Oman",2.2877902251308946,"Malaysia, Peru, SouthAfrica, Turkey, Paraguay",1.1537986717139237,"Uruguay, India, Georgia, Serbia, Oman, Brazil, Poland, Azerbaijan",2.443229363046881,"Mexico, Romania, Panama, Malaysia, Peru, SouthAfrica, Turkey, Paraguay",1.1383840917597787,"Uruguay, India, Georgia, Serbia, Oman, Brazil, Poland, Azerbaijan, Hungary, China",2.3890618190409723,"Chile, Colombia, Mexico, Romania, Panama, Malaysia, Peru, SouthAfrica, Turkey, Paraguay"
2024-09-30,2024,10,2024-10,23,-3.49273167560645,-1.2976476167096518,Georgia,0.9730826157865022,-3.372433838266764,SouthAfrica,0.0002110314949438054,-0.728378103814035,"Georgia, Serbia, Azerbaijan",-3.0430052140408796,"Turkey, Uruguay, SouthAfrica",-1.7609089745276243,"Georgia, Serbia, Azerbaijan, Mexico, Oman",-3.4828786391172373,"Chile, Paraguay, Turkey, Uruguay, SouthAfrica",-2.215998789511825,"Georgia, Serbia, Azerbaijan, Mexico, Oman, Malaysia, Hungary, India",-4.062329579809005,"Brazil, Peru, Panama, Chile, Paraguay, Turkey, Uruguay, SouthAfrica",-2.3272958061298854,"Georgia, Serbia, Azerbaijan, Mexico, Oman, Malaysia, Hungary, India, Poland, China",-3.948082589515625,"Indonesia, Romania, Brazil, Peru, Panama, Chile, Paraguay, Turkey, Uruguay, SouthAfrica"
2024-10-31,2024,11,2024-11,23,1.11242639998724,1.2914986576999965,Mexico,0.998730802882452,1.1173178338901524,Paraguay,0.008082631608891283,1.3283707678679146,"Mexico, Colombia, Romania",1.2630205356279383,"Panama, Turkey, Paraguay",0.9758724020850673,"Mexico, Colombia, Romania, Oman, Serbia",1.0312590426117296,"Georgia, Uruguay, Panama, Turkey, Paraguay",0.871364736541852,"Mexico, Colombia, Romania, Oman, Serbia, Hungary, India, Brazil",1.1852867969076364,"SouthAfrica, Chile, Peru, Georgia, Uruguay, Panama, Turkey, Paraguay",1.045405110670714,"Mexico, Colombia, Romania, Oman, Serbia, Hungary, India, Brazil, Malaysia, Poland",1.0493157546397747,"Indonesia, Azerbaijan, SouthAfrica, Chile, Peru, Georgia, Uruguay, Panama, Turkey, Paraguay"
2024-11-29,2024,12,2024-12,23,-2.2987990794716016,-2.928703822468659,Mexico,0.997146469519442,-2.8287310768375873,Paraguay,0.005519031720189881,-2.8782115442755996,"Mexico, Malaysia, Colombia",-2.8027819869286077,"Peru, Uruguay, Paraguay",-2.0370976596330426,"Mexico, Malaysia, Colombia, Serbia, Hungary",-2.2754435578215864,"SouthAfrica, China, Peru, Uruguay, Paraguay",-1.8356858664580438,"Mexico, Malaysia, Colombia, Serbia, Hungary, India, Oman, Romania",-2.1882744946555954,"Georgia, Panama, Turkey, SouthAfrica, China, Peru, Uruguay, Paraguay",-2.073929718493225,"Mexico, Malaysia, Colombia, Serbia, Hungary, India, Oman, Romania, Brazil, Indonesia",-2.2772562271148034,"Philippines, Chile, Georgia, Panama, Turkey, SouthAfrica, China, Peru, Uruguay, Paraguay"
2024-12-31,2025,1,2025-01,23,0.9367910852308072,1.265330681218746,Colombia,0.9920514365644512,0.4604606390625321,Philippines,0.00027055270090874285,1.5933663035269034,"Colombia, Panama, Turkey",0.37835668500881453,"Uruguay, Georgia, Philippines",1.6884559039391345,"Colombia, Panama, Turkey, Brazil, Azerbaijan",0.43092092698619133,"India, China, Uruguay, Georgia, Philippines",1.4078760986111298,"Colombia, Panama, Turkey, Brazil, Azerbaijan, Hungary, Paraguay, Chile",0.413942490968483,"SouthAfrica, Oman, Serbia, India, China, Uruguay, Georgia, Philippines",1.277787271491262,"Colombia, Panama, Turkey, Brazil, Azerbaijan, Hungary, Paraguay, Chile, Kazakhstan, Poland",0.41942505660402585,"Malaysia, Romania, SouthAfrica, Oman, Serbia, India, China, Uruguay, Georgia, Philippines"
2025-01-31,2025,2,2025-02,23,2.3093301887581967,2.52188442007224,Colombia,0.9563008746475063,1.9166711171205497,SouthAfrica,0.008965614914978215,1.653051822832759,"Colombia, Azerbaijan, Turkey",2.3756558929927563,"Philippines, Romania, SouthAfrica",2.0433168775936528,"Colombia, Azerbaijan, Turkey, Panama, Peru",1.924297336299805,"Indonesia, Serbia, Philippines, Romania, SouthAfrica",2.1603623858458874,"Colombia, Azerbaijan, Turkey, Panama, Peru, India, Paraguay, Hungary",1.9090512692663015,"China, Uruguay, Georgia, Indonesia, Serbia, Philippines, Romania, SouthAfrica",2.141362937884776,"Colombia, Azerbaijan, Turkey, Panama, Peru, India, Paraguay, Hungary, Oman, Kazakhstan",2.0428639891161615,"Malaysia, Brazil, China, Uruguay, Georgia, Indonesia, Serbia, Philippines, Romania, SouthAfrica"
2025-02-28,2025,3,2025-03,23,-0.15170976829104477,-0.9332963851227061,Turkey,0.990996882184381,0.08235097363957777,Romania,0.013515166780495429,-0.5146171235457279,"Turkey, Philippines, Colombia",-0.26229349942574753,"Mexico, Malaysia, Romania",-0.2901859231068382,"Turkey, Philippines, Colombia, Azerbaijan, India",-0.31870701490244624,"Indonesia, Uruguay, Mexico, Malaysia, Romania",-0.02994970086815374,"Turkey, Philippines, Colombia, Azerbaijan, India, China, Brazil, Oman",-0.023486561598559663,"Panama, Georgia, Serbia, Indonesia, Uruguay, Mexico, Malaysia, Romania",-0.15814219017525777,"Turkey, Philippines, Colombia, Azerbaijan, India, China, Brazil, Oman, SouthAfrica, Paraguay",-0.03705898190910051,"Hungary, Poland, Panama, Georgia, Serbia, Indonesia, Uruguay, Mexico, Malaysia, Romania"
2025-03-31,2025,4,2025-04,23,-0.4938185694423908,-0.058251036170264836,China,0.9801222715937489,-1.2079056209419958,SouthAfrica,0.019525483853985007,-0.9409487822171769,"China, Azerbaijan, Colombia",-0.9195011569712586,"Malaysia, Uruguay, SouthAfrica",-0.6009652887144568,"China, Azerbaijan, Colombia, India, Turkey",-1.0024570365220753,"Romania, Panama, Malaysia, Uruguay, SouthAfrica",-0.3654088146324924,"China, Azerbaijan, Colombia, India, Turkey, Oman, Hungary, Georgia",-0.8212098209728541,"Chile, Brazil, Mexico, Romania, Panama, Malaysia, Uruguay, SouthAfrica",-0.5036158193032692,"China, Azerbaijan, Colombia, India, Turkey, Oman, Hungary, Georgia, Kazakhstan, Serbia",-0.5689083875127809,"Paraguay, Poland, Chile, Brazil, Mexico, Romania, Panama, Malaysia, Uruguay, SouthAfrica"
2025-04-30,2025,5,2025-05,23,0.24446810944818514,0.5072477883304893,India,0.9701837216203473,-0.34304650162926276,Brazil,0.057702742554284134,1.2106673538602248,"India, Colombia, Mexico",-0.06708758113597169,"Peru, Panama, Brazil",0.8376081805577096,"India, Colombia, Mexico, Indonesia, Oman",0.47869213230044005,"Azerbaijan, SouthAfrica, Peru, Panama, Brazil",0.5759408300431285,"India, Colombia, Mexico, Indonesia, Oman, Malaysia, Turkey, China",0.1126342329594951,"Kazakhstan, Paraguay, Poland, Azerbaijan, SouthAfrica, Peru, Panama, Brazil",0.5402262197575902,"India, Colombia, Mexico, Indonesia, Oman, Malaysia, Turkey, China, Philippines, Georgia",-0.08354774933982845,"Chile, Uruguay, Kazakhstan, Paraguay, Poland, Azerbaijan, SouthAfrica, Peru, Panama, Brazil"
2025-05-30,2025,6,2025-06,23,2.5509567168720064,2.5080017926398357,Turkey,0.9698908858493162,1.8982844095694285,Philippines,0.0034582089007233344,2.1824640029295184,"Turkey, Colombia, Oman",2.642957262899167,"SouthAfrica, Brazil, Philippines",2.520343630606452,"Turkey, Colombia, Oman, India, Panama",2.895705361468854,"Uruguay, Mexico, SouthAfrica, Brazil, Philippines",2.512657062713264,"Turkey, Colombia, Oman, India, Panama, Romania, Indonesia, Hungary",2.3402506218084183,"Georgia, Malaysia, Serbia, Uruguay, Mexico, SouthAfrica, Brazil, Philippines",2.4142106388002915,"Turkey, Colombia, Oman, India, Panama, Romania, Indonesia, Hungary, Chile, Azerbaijan",2.250588800664979,"Poland, China, Georgia, Malaysia, Serbia, Uruguay, Mexico, SouthAfrica, Brazil, Philippines"
2025-06-30,2025,7,2025-07,23,0.825488219261369,1.7211754534518064,Oman,0.9609586709778783,0.7439078512828656,Philippines,0.032799300228322496,1.5077067161418656,"Oman, Indonesia, Colombia",0.9017392256614946,"SouthAfrica, Romania, Philippines",1.2605519915103702,"Oman, Indonesia, Colombia, Georgia, China",0.8585346224725354,"Turkey, Malaysia, SouthAfrica, Romania, Philippines",1.0778153414510245,"Oman, Indonesia, Colombia, Georgia, China, India, Azerbaijan, Brazil",0.8018959097640527,"Chile, Panama, Uruguay, Turkey, Malaysia, SouthAfrica, Romania, Philippines",0.9564862109985196,"Oman, Indonesia, Colombia, Georgia, China, India, Azerbaijan, Brazil, Paraguay, Mexico",0.7321349387698817,"Hungary, Serbia, Chile, Panama, Uruguay, Turkey, Malaysia, SouthAfrica, Romania, Philippines"
2025-07-31,2025,8,2025-08,23,1.0347405911743979,0.6802989211827093,Georgia,0.9860582599593877,1.4782316586949396,SouthAfrica,0.01966212480069128,0.5933596641624886,"Georgia, Oman, India",1.1323315897859028,"Uruguay, Brazil, SouthAfrica",0.684920751222653,"Georgia, Oman, India, China, Hungary",1.1689566267170948,"Philippines, Mexico, Uruguay, Brazil, SouthAfrica",0.767405847957689,"Georgia, Oman, India, China, Hungary, Chile, Kazakhstan, Paraguay",1.1434682534707696,"Panama, Serbia, Malaysia, Philippines, Mexico, Uruguay, Brazil, SouthAfrica",0.7198278432272165,"Georgia, Oman, India, China, Hungary, Chile, Kazakhstan, Paraguay, Indonesia, Poland",1.0136245712433034,"Azerbaijan, Romania, Panama, Serbia, Malaysia, Philippines, Mexico, Uruguay, Brazil, SouthAfrica"
2025-08-29,2025,9,2025-09,23,2.462002340746299,1.0677063715448742,Azerbaijan,0.9978839394745969,3.979933027729299,SouthAfrica,0.004068606444522549,1.2134301912868646,"Azerbaijan, Georgia, Oman",3.0621672034422787,"Brazil, Uruguay, SouthAfrica",1.5036931692360112,"Azerbaijan, Georgia, Oman, India, Peru",3.1737591718976788,"Panama, Turkey, Brazil, Uruguay, SouthAfrica",1.8492354923335452,"Azerbaijan, Georgia, Oman, India, Peru, Mexico, Kazakhstan, Philippines",2.4119592053923693,"China, Malaysia, Serbia, Panama, Turkey, Brazil, Uruguay, SouthAfrica",2.0002251266849824,"Azerbaijan, Georgia, Oman, India, Peru, Mexico, Kazakhstan, Philippines, Romania, Chile",2.412430435287982,"Colombia, Indonesia, China, Malaysia, Serbia, Panama, Turkey, Brazil, Uruguay, SouthAfrica"
